{
  "schema_version": 1,
  "domain_id": "EDD-001",
  "board_id": "project-027-edd001",
  "scope_status": "FROZEN",
  "evidence_status": "PARTIAL",
  "execution_status": "NOT_READY",
  "verification_status": "NOT_RUN",
  "approval_status": "PENDING",
  "files": [
    {
      "role": "gate_contract",
      "repo_path": "gates/contracts/edd001_core_base_contract_v1.json",
      "size_bytes": 10058,
      "sha256": "d7dd6982fb82367c5f3516e67e91b8cf65da20c44621c47fd59d526e411d9473",
      "source_class": "VERIFIED_SOURCE",
      "required": true
    },
    {
      "role": "evidence_contract",
      "repo_path": "src/hardware/edd001-board/evidence/contracts/edd001_core_base_contract_v1.json",
      "size_bytes": 10058,
      "sha256": "d7dd6982fb82367c5f3516e67e91b8cf65da20c44621c47fd59d526e411d9473",
      "source_class": "VERIFIED_SOURCE",
      "required": true
    },
    {
      "role": "gate_contract",
      "repo_path": "gates/contracts/edd001_pin_constraints_v1.json",
      "size_bytes": 8610,
      "sha256": "e3b75e74860aa43df3fe5f3e5dad4f61d3b80cd9879b32215ae447718e8fd569",
      "source_class": "VERIFIED_SOURCE",
      "required": true
    },
    {
      "role": "evidence_contract",
      "repo_path": "src/hardware/edd001-board/evidence/contracts/edd001_pin_constraints_v1.json",
      "size_bytes": 8610,
      "sha256": "e3b75e74860aa43df3fe5f3e5dad4f61d3b80cd9879b32215ae447718e8fd569",
      "source_class": "VERIFIED_SOURCE",
      "required": true
    },
    {
      "role": "gate_contract",
      "repo_path": "gates/contracts/edd001_usb_contract_v1.json",
      "size_bytes": 6038,
      "sha256": "0094292e2340b7a7d058c1b7fb4d1ff0b0f4457c9093dec2c1b146eb56e8c911",
      "source_class": "VERIFIED_SOURCE",
      "required": true
    },
    {
      "role": "evidence_contract",
      "repo_path": "src/hardware/edd001-board/evidence/contracts/edd001_usb_contract_v1.json",
      "size_bytes": 6038,
      "sha256": "0094292e2340b7a7d058c1b7fb4d1ff0b0f4457c9093dec2c1b146eb56e8c911",
      "source_class": "VERIFIED_SOURCE",
      "required": true
    },
    {
      "role": "evidence_datasheet",
      "repo_path": "src/hardware/edd001-board/evidence/datasheets/WROOM1_DATASHEET/esp32-s3-wroom-1_datasheet_en.pdf",
      "size_bytes": 1280501,
      "sha256": "27d71971da07c280c6068d08c74720d1a25b8f20cf8494dc1765bdd28d40d435",
      "source_class": "VERIFIED_SOURCE",
      "required": true
    },
    {
      "role": "evidence_datasheet",
      "repo_path": "src/hardware/edd001-board/evidence/datasheets/ESP32_S3_TECHPEDIA/ap63203_datasheet_ds41326-rev3-2.pdf",
      "size_bytes": 1226090,
      "sha256": "ef99daa3789d835bc025dfcb4c605c5c2e6d3e7223e86d40b33e6b497ea5a722",
      "source_class": "VERIFIED_SOURCE",
      "required": true
    },
    {
      "role": "evidence_datasheet",
      "repo_path": "src/hardware/edd001-board/evidence/datasheets/LCSC_C165948/type-c-31-m-12_drawing.pdf",
      "size_bytes": 118176,
      "sha256": "6ae33d50ac47820114661138dc4e4659f40fdc5d4f485b46685dfec338da1a9e",
      "source_class": "VERIFIED_SOURCE",
      "required": true
    },
    {
      "role": "evidence_datasheet",
      "repo_path": "src/hardware/edd001-board/evidence/datasheets/ST_USBLC6_2/usblc6-2_datasheet.pdf",
      "size_bytes": 575521,
      "sha256": "bc30154f310cd631043214ed52571daefe04270587ec55072d49a23bd18b9068",
      "source_class": "VERIFIED_SOURCE",
      "required": true
    },
    {
      "role": "evidence_datasheet",
      "repo_path": "src/hardware/edd001-board/evidence/datasheets/SS34/ss34_datasheet_mdd.pdf",
      "size_bytes": 1300729,
      "sha256": "fb4970875779696914d235bcf954240569302fb325399838f2861d474cbf9760",
      "source_class": "VERIFIED_SOURCE",
      "required": true
    },
    {
      "role": "evidence_datasheet",
      "repo_path": "src/hardware/edd001-board/evidence/datasheets/ESPRESSIF_S3_LCD_EV_BOARD/sch_esp32-s3-lcd-ev-board-mb_v1-5.pdf",
      "size_bytes": 1607358,
      "sha256": "384f0639b2c38e90e0065ec80722c2dd801d1f69476f85465d02e834a8915fd3",
      "source_class": "VERIFIED_SOURCE",
      "required": true
    }
  ],
  "mirror_sets": [
    {
      "authoritative_path": "gates/contracts/edd001_core_base_contract_v1.json",
      "mirror_path": "src/hardware/edd001-board/evidence/contracts/edd001_core_base_contract_v1.json",
      "expected_equal": true
    },
    {
      "authoritative_path": "gates/contracts/edd001_pin_constraints_v1.json",
      "mirror_path": "src/hardware/edd001-board/evidence/contracts/edd001_pin_constraints_v1.json",
      "expected_equal": true
    },
    {
      "authoritative_path": "gates/contracts/edd001_usb_contract_v1.json",
      "mirror_path": "src/hardware/edd001-board/evidence/contracts/edd001_usb_contract_v1.json",
      "expected_equal": true
    }
  ],
  "missing_requirements": [
    {
      "id": "EDD001_POWER_CONTRACT",
      "kind": "contract",
      "reason_code": "EVIDENCE_MISSING",
      "description": "EDD-001 power contract not yet authored as FROZEN; a DRAFT exists from W4A collision 1 (gates/contracts/edd001_power_contract_v1.json, based on DS41326 Rev. 3-2 with provenance-pinned sources) but a draft cannot satisfy this requirement"
    }
  ],
  "tool_coverage": {
    "compilers": [],
    "verifiers": []
  },
  "notes": [
    "Truthful manifest for the six current EDD-001 contract files (three gates/contracts authoritative, three evidence/contracts mirrors).",
    "source URLs inside the contract files are references only, not frozen local evidence; no datasheet has been frozen for EDD-001 yet. [SUPERSEDED 2026-10-02: the six datasheets were frozen on disk; kept as the state at writing]",
    "evidence_status PARTIAL is the honest state: contract bundle present and hash-verified, engineering sources missing; no example data is used to manufacture COMPLETE. [SUPERSEDED 2026-10-02 for the six frozen datasheets; still truthful for everything else]",
    "generated_at intentionally omitted: no caller-supplied deterministic time value is available and a wall-clock timestamp would break reproducibility.",
    "V2 protocol frozen 2026-09-01 (sha256 f7d44732785d17a20283f3a18fde7689eebfee78f10a93ae899e1dd116383cad): approval authority now requires a candidate-bound HumanApprovalReceipt; this manifest's approval_status=PENDING remains truthful - no human approval receipt exists for EDD-001.",
    "GH-20 Tasks 6-7 alignment (2026-09-02): required component set converges on the frozen contracts. Runtime collection now includes the nested regulator_3v3.device (AP63203WU-7) alongside the direct SS34 declaration, so missing_requirements lists POWER plus five component evidence items.",
    "SS34 evidence id ESPRESSIF_S3_LCD_EV_BOARD is declared by frozen USB contract rule USB_VBUS_REVERSE_PROTECTION (source_ids). Mapping check (2026-09-02, GH-20 tail): the official ESP32-S3-LCD-EV-Board user guide schematic page 'Power Supply over USB' shows D1 = SS34 in the USB VBUS to USB_5V path; the mapping is corroborated at reference-design level and no frozen contract content change is needed. Per the source classification below, this is authoritative reference design evidence, not exact-component evidence; freezing the SS34 vendor datasheet itself remains W4A (Issue #2).",
    "ESPRESSIF_S3_LCD_EV_BOARD source classification (Owner adjudication 2026-09-02): source_role=authoritative_reference_design; exact_component_evidence=false. applicable_to: ESP32-S3-WROOM-1 family reference / USB-C device-side topology / native USB D+/D- reference / BOOT-RESET circuitry / UART auto-download architecture / board-level power-entry and protection reference. not_valid_for: exact ESP32-S3-WROOM-1-N8R8 SKU evidence / SHT40 component evidence / 3.3V regulator current-thermal qualification / exact BOM equivalence. Version boundary: the referenced ESP32-S3-LCD-EV-Board revisions use different ESP32-S3-WROOM-1 variants from the project target N8R8 (legacy DigiKey PDF = N16R8; v1.5 = N16R16V with a 1.8V rail and IO47/48 handling absent on this board); therefore the material is authoritative as a reference design, but not as exact-component evidence. The v1.5 regulators (SY8088/ETA3409/ME6211, where ME6211 powers the 1.8V rail) are NOT precedent for this board's AP63203WU-7 3.3V buck.",
    "W4A collision 1 (2026-09-02): six remote evidence records pinned in metadata.remote_evidence (5 exact-component + 1 reference-design). All six carry redistribution TO_VERIFY (in-document copyright notices reserve rights; no redistribution grants found), so per the Owner ruling binaries stay OUT of the repository and missing_requirements intentionally remain - provenance debt cleared, local-freeze debt honestly red. Reviewer implementation note honored: TO_VERIFY remote sources never masquerade as local frozen files.",
    "POWER contract DRAFT (2026-09-02): gates/contracts/edd001_power_contract_v1.json + evidence/contracts mirror, evidence-first per DS41326 Rev. 3-2 Table 2 (Cin 10uF / Cout 2x22uF / L 3.9uH / CBST 100nF; EN UVLO 1.18V; USBLC6 as USB data/VBUS protection network, not a series power element; SS34 as VBUS reverse-protection diode). DRAFT is not frozen and does not satisfy EDD001_POWER_CONTRACT; freeze requires human review in a follow-up collision.",
    "Review iteration 1 correction (2026-09-02): POWER DRAFT inductor was mis-copied as 4.7uH from DS41326 Rev. 3-2 Figure 2 (drawn for AP63205/5V); Table 2 for AP63203/3.3V specifies L = 3.9uH. Corrected across the contract, its mirror, and ledgers. EV-board corroboration narrowed to the USB VBUS -> SS34 -> protected rail segment only.",